{"$schema":"https://json-schema.org/draft/2020-12/schema","type":"object","additionalProperties":false,"required":["schemaVersion","producerRepo","producerModule","producerCommit","generatedAt","caution","metadataPanel","actionable"],"properties":{"schemaVersion":{"const":"environment_integrity_dashboard_v1"},"producerRepo":{"type":"string"},"producerModule":{"type":"string"},"producerCommit":{"type":"string"},"generatedAt":{"type":"string"},"caution":{"type":"string"},"metadataPanel":{"type":"object","additionalProperties":false,"required":["provenanceSummary","markersCleared"],"properties":{"provenanceSummary":{"type":"string"},"markersCleared":{"type":"boolean"},"sourceDashboards":{"type":"array","items":{"type":"string"}}}},"actionable":{"type":"array","items":{"$ref":"#/$defs/item"}}},"$defs":{"item":{"type":"object","additionalProperties":false,"required":["targetId","anomalyDomain","attackSurfaceClass","environmentIntegrityScore","evidenceMaturity","counterHypothesis","provenanceMarkers","uiClass"],"properties":{"targetId":{"type":"string"},"anomalyDomain":{"enum":["digital","social_behavioral","mixed"]},"attackSurfaceClass":{"enum":["platform","social","account","device","network"]},"environmentIntegrityScore":{"type":"number","minimum":0,"maximum":1},"evidenceMaturity":{"enum":["artifact","repeatable_test","independently_verified","conclusion_ready"]},"counterHypothesis":{"type":"object","additionalProperties":false,"required":["count","status"],"properties":{"count":{"type":"integer","minimum":0},"status":{"enum":["verify","watch","hold"]}}},"provenanceMarkers":{"type":"array","items":{"type":"string"}},"uiClass":{"enum":["subtle-info","subtle-critical"]}}}}}
